Test file,Test index,Smell,Hint,Where,Term,Sentence
../testcases/image/1433_Post-installation (Xubuntu),0,Ambiguous Test,adverb of manner,action,physically,"If you set up networking and are physically connected to the Internet, open Firefox and load xubuntu.org"
../testcases/image/1433_Post-installation (Xubuntu),0,Ambiguous Test,adverb of manner,verification,correctly,The applications are installed correctly and appear in the applications menu
../testcases/image/1433_Post-installation (Xubuntu),0,Ambiguous Test,adverb of manner,verification,properly,The session is terminated properly
../testcases/image/1433_Post-installation (Xubuntu),0,Ambiguous Test,verb + indefinite determiner,action,have a,"If you have a USB drive, plug it in"
../testcases/image/1433_Post-installation (Xubuntu),0,Ambiguous Test,verb + indefinite determiner,action,have a,"If you have a DVD or an audio CD, insert it"
../testcases/image/1433_Post-installation (Xubuntu),0,Ambiguous Test,verb + indefinite determiner,action,Open a,Open a text editor and write some text
../testcases/image/1433_Post-installation (Xubuntu),0,Ambiguous Test,verb + indefinite determiner,action,write some,Open a text editor and write some text
../testcases/image/1433_Post-installation (Xubuntu),1,Ambiguous Test,verb + indefinite determiner,action,run any,Click the Application Finder icon and run any application from it
../testcases/image/1434_Desktop (Xubuntu),0,Ambiguous Test,verb + indefinite determiner,verification,are no,Confirm that there are no missing/wrong icons in the applications you tested
../testcases/image/1434_Desktop (Xubuntu),3,Ambiguous Test,verb + indefinite determiner,action,Add a,Add a few new keyboard layouts
../testcases/image/1434_Desktop (Xubuntu),4,Ambiguous Test,adverb of manner,action,successfully,"When they have been successfully installed, log out from the session, and select alternating languages at the login screen, next to the right of the session selector (Xubuntu Session)"
../testcases/image/1434_Desktop (Xubuntu),5,Ambiguous Test,verb + indefinite determiner,action,add a,Go to Applications ->Settings Manager ->Users and Groupsand add a new user
../testcases/image/1434_Desktop (Xubuntu),7,Ambiguous Test,adverb of manner,verification,succesfully,Does it wake up succesfully?
../testcases/image/1434_Desktop (Xubuntu),7,Ambiguous Test,adverb of manner,verification,successfully,Does it fall asleep after that time and does it wake up again successfully?
../testcases/image/1434_Desktop (Xubuntu),9,Ambiguous Test,verb + indefinite determiner,action,print a,Try to print a test page
../testcases/image/1434_Desktop (Xubuntu),10,Ambiguous Test,verb + indefinite determiner,action,pair a,Try to pair a Bluetooth device using the Bluetooth symbol in the panel.
../testcases/image/1434_Desktop (Xubuntu),10,Ambiguous Test,verb + indefinite determiner,action,send a,Try to send a file from your device to your computer and the other way round
../testcases/image/1436_Post-Installation Tests,0,Ambiguous Test,adverb of manner,verification,correctly,"The result correctly lists the architecture of the installation you installed. For example, x86_64 for 64-bit x86 machine."
../testcases/image/1436_Post-Installation Tests,0,Ambiguous Test,adverb of manner,verification,properly,The ubuntu homepage is loaded and displays properly
../testcases/image/1436_Post-Installation Tests,0,Ambiguous Test,adjective,action,earlier,Launch 'software-updater' (precise and earlier version are called update-manager) and install any updates presented
../testcases/image/1436_Post-Installation Tests,0,Ambiguous Test,verb + indefinite determiner,action,install any,Launch 'software-updater' (precise and earlier version are called update-manager) and install any updates presented
../testcases/image/1436_Post-Installation Tests,0,Ambiguous Test,verb + indefinite determiner,action,installed a,"If you installed a non-english version of FAMILY, note the language used on the desktop"
../testcases/image/1437_Alternate Install (Entire Disk),0,Ambiguous Test,adverb of manner,action,correctly,Login and check the system installed correctly
../testcases/image/1437_Alternate Install (Entire Disk),0,Ambiguous Test,adverb of manner,verification,actually,Wait for a while - The install may seem like it has locked at a percentage but is actually working in the background. You can check and see if it is working by switching to tty4 (alt + f4).
../testcases/image/1437_Alternate Install (Entire Disk),0,Ambiguous Test,adjective,verification,stronger,"You should be prompted to confirm ( If you entered a weak password, confirm that you want to keep it or select no and enter a stronger one)."
../testcases/image/1437_Alternate Install (Entire Disk),0,Ambiguous Test,verb + indefinite determiner,action,Add a,Add a hostname for the machine and press Enter
../testcases/image/1437_Alternate Install (Entire Disk),0,Ambiguous Test,verb + indefinite determiner,action,Add a,Add a password and press Enter
../testcases/image/1437_Alternate Install (Entire Disk),0,Ambiguous Test,verb + indefinite determiner,verification,enter a,You should be prompted to enter a password
../testcases/image/1437_Alternate Install (Entire Disk),0,Ambiguous Test,verb + indefinite determiner,verification,entered a,"You should be prompted to confirm ( If you entered a weak password, confirm that you want to keep it or select no and enter a stronger one)."
../testcases/image/1437_Alternate Install (Entire Disk),0,Ambiguous Test,verb + indefinite determiner,verification,enter a,"You should be prompted to confirm ( If you entered a weak password, confirm that you want to keep it or select no and enter a stronger one)."
../testcases/image/1437_Alternate Install (Entire Disk),0,Ambiguous Test,verb + indefinite determiner,verification,see an,You should see an option to select a disk to install on
../testcases/image/1437_Alternate Install (Entire Disk),0,Ambiguous Test,verb + indefinite determiner,verification,select a,You should see an option to select a disk to install on
../testcases/image/1437_Alternate Install (Entire Disk),0,Ambiguous Test,verb + indefinite determiner,verification,see a,You should see a request for http proxy information
../testcases/image/1437_Alternate Install (Entire Disk),0,Ambiguous Test,verb + indefinite determiner,verification,see a,You should see a request to confirm date and time
../testcases/image/1438_Alternate Install (Guided),0,Ambiguous Test,adverb of manner,action,correctly,Login and check the system installed correctly
../testcases/image/1438_Alternate Install (Guided),0,Ambiguous Test,adverb of manner,verification,actually,Wait for a while - The install may seem like it has locked at a percentage but is actually working in the background. You can check and see if it is working by switching to tty4 (alt + f4).
../testcases/image/1438_Alternate Install (Guided),0,Ambiguous Test,adjective,verification,stronger,"You should be prompted to confirm ( If you entered a weak password, confirm that you want to keep it or select no and enter a stronger one)."
../testcases/image/1438_Alternate Install (Guided),0,Ambiguous Test,verb + indefinite determiner,action,Add a,Add a hostname for the machine and press Enter
../testcases/image/1438_Alternate Install (Guided),0,Ambiguous Test,verb + indefinite determiner,action,Add a,Add a password and press Enter
../testcases/image/1438_Alternate Install (Guided),0,Ambiguous Test,verb + indefinite determiner,verification,enter a,You should be prompted to enter a password
../testcases/image/1438_Alternate Install (Guided),0,Ambiguous Test,verb + indefinite determiner,verification,entered a,"You should be prompted to confirm ( If you entered a weak password, confirm that you want to keep it or select no and enter a stronger one)."
../testcases/image/1438_Alternate Install (Guided),0,Ambiguous Test,verb + indefinite determiner,verification,enter a,"You should be prompted to confirm ( If you entered a weak password, confirm that you want to keep it or select no and enter a stronger one)."
../testcases/image/1438_Alternate Install (Guided),0,Ambiguous Test,verb + indefinite determiner,verification,see a,You should see a request for http proxy information
../testcases/image/1438_Alternate Install (Guided),0,Ambiguous Test,verb + indefinite determiner,verification,see a,You should see a request to confirm date and time
../testcases/image/1439_Alternate Install (Encryption),0,Ambiguous Test,adverb of manner,action,correctly,Login and check the system installed correctly
../testcases/image/1439_Alternate Install (Encryption),0,Ambiguous Test,adverb of manner,verification,actually,Wait for a while - The install may seem like it has locked at a percentage but is actually working in the background. You can check and see if it is working by switching to tty4 (alt + f4).
../testcases/image/1439_Alternate Install (Encryption),0,Ambiguous Test,adjective,verification,stronger,"You should be prompted to confirm ( If you entered a weak password, confirm that you want to keep it or select no and enter a stronger one)."
../testcases/image/1439_Alternate Install (Encryption),0,Ambiguous Test,verb + indefinite determiner,action,Add a,Add a hostname for the machine and press Enter
../testcases/image/1439_Alternate Install (Encryption),0,Ambiguous Test,verb + indefinite determiner,action,Add a,Add a password and press Enter
../testcases/image/1439_Alternate Install (Encryption),0,Ambiguous Test,verb + indefinite determiner,action,Enter an,Enter an encryption passphrase and press Enter
../testcases/image/1439_Alternate Install (Encryption),0,Ambiguous Test,verb + indefinite determiner,action,Specify an,Specify an amount of the volume group to use for guided partitioning and press Enter
../testcases/image/1439_Alternate Install (Encryption),0,Ambiguous Test,verb + indefinite determiner,verification,enter a,You should be prompted to enter a password
../testcases/image/1439_Alternate Install (Encryption),0,Ambiguous Test,verb + indefinite determiner,verification,entered a,"You should be prompted to confirm ( If you entered a weak password, confirm that you want to keep it or select no and enter a stronger one)."
../testcases/image/1439_Alternate Install (Encryption),0,Ambiguous Test,verb + indefinite determiner,verification,enter a,"You should be prompted to confirm ( If you entered a weak password, confirm that you want to keep it or select no and enter a stronger one)."
../testcases/image/1439_Alternate Install (Encryption),0,Ambiguous Test,verb + indefinite determiner,verification,see an,You should see an option to select a disk to install on
../testcases/image/1439_Alternate Install (Encryption),0,Ambiguous Test,verb + indefinite determiner,verification,select a,You should see an option to select a disk to install on
../testcases/image/1439_Alternate Install (Encryption),0,Ambiguous Test,verb + indefinite determiner,verification,enter an,You should be asked to enter an encryption passphraser
../testcases/image/1439_Alternate Install (Encryption),0,Ambiguous Test,verb + indefinite determiner,verification,specify an,You should be asked to specify an amount of the volume group to use for guided partitioning
../testcases/image/1439_Alternate Install (Encryption),0,Ambiguous Test,verb + indefinite determiner,verification,see a,You should see a request to confirm writing the changes to disk
../testcases/image/1439_Alternate Install (Encryption),0,Ambiguous Test,verb + indefinite determiner,verification,see a,You should see a request for http proxy information
../testcases/image/1439_Alternate Install (Encryption),0,Ambiguous Test,verb + indefinite determiner,verification,see a,You should see a request to confirm date and time
../testcases/image/1440_Live LTSP,0,Ambiguous Test,adverb of manner,verification,properly,Edubuntu desktop boots up properly
../testcases/image/1440_Live LTSP,0,Ambiguous Test,verb + indefinite determiner,action,Select an,Select an unused network interface
../testcases/image/1440_Live LTSP,0,Ambiguous Test,verb + indefinite determiner,action,Boot a,Boot a thin client and configure it to utilize the live LTSP server
../testcases/image/1440_Live LTSP,0,Ambiguous Test,verb + indefinite determiner,verification,displays a,"""LTSP Live"" launches and displays a prompt"
../testcases/image/1440_Live LTSP,0,Ambiguous Test,verb + indefinite determiner,verification,obtains a,Thin client boots and obtains a working desktop from server
../testcases/image/1441_Install (No Network Connection),0,Ambiguous Test,verb + indefinite determiner,action,acquire a,"The installer will fail to acquire a DHCP address. Accept Continue, and then select Do not configure network at this time"
../testcases/image/1441_Install (No Network Connection),0,Ambiguous Test,verb + indefinite determiner,action,Choose a,Choose a password
../testcases/image/1442_Mythbuntu Frontend,0,Ambiguous Test,adverb of manner,action,only,"Select ""Watch TV"". (this will only work if you have a backend already in the network)"
../testcases/image/1442_Mythbuntu Frontend,0,Ambiguous Test,adjective,action,Most,"Go though the Ubiquity install as you would any other install. Most options won't matter for this testcase, but be sure to choose the following options' "
../testcases/image/1442_Mythbuntu Frontend,0,Ambiguous Test,verb + indefinite determiner,action,have a,"Select ""Watch TV"". (this will only work if you have a backend already in the network)"
../testcases/image/1442_Mythbuntu Frontend,0,Ambiguous Test,verb + indefinite determiner,verification,have no,"Do NOT name the user mythtvAutomatic (Guided) Partitioning""Frontend""If you have no remote, choose no remote suppportFor the security key, enter the PIN from the backend (in the backend testcase, this is set to 1234)"
../testcases/image/1442_Mythbuntu Frontend,0,Ambiguous Test,verb + indefinite determiner,verification,choose no,"Do NOT name the user mythtvAutomatic (Guided) Partitioning""Frontend""If you have no remote, choose no remote suppportFor the security key, enter the PIN from the backend (in the backend testcase, this is set to 1234)"
../testcases/image/1443_Rescue Mode,0,Ambiguous Test,adjective,verification,more,This case requires more than one root partition
../testcases/image/1443_Rescue Mode,0,Ambiguous Test,verb + indefinite determiner,action,Rescue a,"Select ""Rescue a broken system"""
../testcases/image/1443_Rescue Mode,0,Ambiguous Test,verb + indefinite determiner,action,Execute a,Execute a shell /dev/sda1 (or what you have choosed as root filesytem)
../testcases/image/1443_Rescue Mode,0,Ambiguous Test,verb + indefinite determiner,action,Execute a,Execute a shell in the installer environement
../testcases/image/1443_Rescue Mode,0,Ambiguous Test,verb + indefinite determiner,action,Choose a,Choose a different root file system
../testcases/image/1443_Rescue Mode,0,Ambiguous Test,verb + indefinite determiner,verification,is a,Ensure that changes have been made and that there is a new file created
../testcases/image/1443_Rescue Mode,0,Ambiguous Test,verb + indefinite determiner,verification,Ensure that,Ensure that chroot works and that files are listed in both enviroments
../testcases/image/1443_Rescue Mode,0,Ambiguous Test,verb + indefinite determiner,verification,place a,Select Reinstall GRUB boot loader and press Enter. Doing this will remove your Grub config and mbr and place a new automatic version in it's place
../testcases/image/1443_Rescue Mode,0,Ambiguous Test,verb + indefinite determiner,verification,Choose a,Select Choose a different root file system
../testcases/image/1444_Mythbuntu Backend & Frontend,0,Ambiguous Test,adverb of manner,verification,safely,You may get a warning that the tuner is set to start on a channel that doesn't exist. This can be safely ignored since we are using a test recorder.
../testcases/image/1444_Mythbuntu Backend & Frontend,0,Ambiguous Test,adjective,action,Most,"Go though the Ubiquity install as you would any other install. Most options won't matter for this testcase, but be sure to choose the following options"
../testcases/image/1444_Mythbuntu Backend & Frontend,0,Ambiguous Test,verb + indefinite determiner,action,Download a,"Download a demo file. I recommend a MP4 trailer (for example, the 480p MP4 trailer at http://www.sintel.org/download )."
../testcases/image/1444_Mythbuntu Backend & Frontend,0,Ambiguous Test,verb + indefinite determiner,action,recommend a,"Download a demo file. I recommend a MP4 trailer (for example, the 480p MP4 trailer at http://www.sintel.org/download )."
../testcases/image/1444_Mythbuntu Backend & Frontend,0,Ambiguous Test,verb + indefinite determiner,action,move this,"Once downloaded, move this file to the /srv/ directory (it must be outside your home directory)"
../testcases/image/1444_Mythbuntu Backend & Frontend,0,Ambiguous Test,verb + indefinite determiner,verification,have no,"Do NOT name the user mythtvAutomatic (Guided) Partitioning""Primary Backend w/ Frontend""""MythTV service"" checkbox is checkedIf you have no remote, choose no remote suppport"
../testcases/image/1444_Mythbuntu Backend & Frontend,0,Ambiguous Test,verb + indefinite determiner,verification,choose no,"Do NOT name the user mythtvAutomatic (Guided) Partitioning""Primary Backend w/ Frontend""""MythTV service"" checkbox is checkedIf you have no remote, choose no remote suppport"
../testcases/image/1444_Mythbuntu Backend & Frontend,0,Ambiguous Test,verb + indefinite determiner,verification,get a,You may get a warning that the tuner is set to start on a channel that doesn't exist. This can be safely ignored since we are using a test recorder.
../testcases/image/1444_Mythbuntu Backend & Frontend,0,Ambiguous Test,verb + indefinite determiner,verification,using a,You may get a warning that the tuner is set to start on a channel that doesn't exist. This can be safely ignored since we are using a test recorder.
../testcases/image/1446_Ubiquity MemTest,0,Ambiguous Test,verb + indefinite determiner,action,press any,"Boot up the image. When you see the aubergine screen with an icon at the bottom, press any key to get the menu"
../testcases/image/1446_Ubiquity MemTest,0,Ambiguous Test,verb + indefinite determiner,verification,show any,The test should finish and show any errors
../testcases/image/1447_Ubiquity Disk Defects,0,Ambiguous Test,verb + indefinite determiner,action,Press any,Press any key to reboot your system
../testcases/image/1448_Unity Lenses,0,Ambiguous Test,adverb of manner,verification,recently,"The search entry should show ""search applications"" and you should have three categories: - recently used apps - installed - apps available for download"
../testcases/image/1448_Unity Lenses,1,Ambiguous Test,adjective,verification,least,"Search results should change, at least on one category"
../testcases/image/1448_Unity Lenses,1,Ambiguous Test,verb + indefinite determiner,action,Make a,Make a search
../testcases/image/1448_Unity Lenses,3,Ambiguous Test,adjective,verification,least,"It should change the results, at least on one category"
../testcases/image/1448_Unity Lenses,3,Ambiguous Test,verb + indefinite determiner,action,Make a,Make a search
../testcases/image/1448_Unity Lenses,5,Ambiguous Test,adjective,verification,least,"It should change the results, at least on one category"
../testcases/image/1448_Unity Lenses,5,Ambiguous Test,verb + indefinite determiner,action,Make a,Make a search
../testcases/image/1448_Unity Lenses,5,Ambiguous Test,verb + indefinite determiner,verification,show some,"it should impact the result on each category. A search for a popular group like ""u2"" should show some online result in an additional category"
../testcases/image/1448_Unity Lenses,6,Ambiguous Test,verb + indefinite determiner,action,Make a,Make a search
../testcases/image/1448_Unity Lenses,6,Ambiguous Test,verb + indefinite determiner,verification,show some,"it should impact the result on each category. A search for a popular group like ""u2"" should show some online result in an additional category"
../testcases/image/1448_Unity Lenses,7,Ambiguous Test,verb + indefinite determiner,verification,showing a,"A lens preview should appear showing a preview of the file (the file icon), with right and left buttons to scroll between previews, and some details on the filename and the time and date information. Further several buttons; email, open/play, and show in folder should exist below the preview"
../testcases/image/1448_Unity Lenses,8,Ambiguous Test,verb + indefinite determiner,verification,showing a,"A lens preview should appear showing a preview of the file (the file icon), with right and left buttons to scroll between previews, and some details on the filename and the time and date information. Further several buttons; open, and show in folder should exist below the preview"
../testcases/image/1448_Unity Lenses,9,Ambiguous Test,adverb of manner,verification,potentially,"A lens preview should appear showing a preview of the application (potentially a screenshot), with right and left buttons to scroll between previews, and some details on the application, including the review from the software center. Further two buttons; uninstall and launch should exist below the preview"
../testcases/image/1448_Unity Lenses,9,Ambiguous Test,adverb of manner,verification,potentially,"A lens preview should appear showing a preview of the application (potentially a screenshot), with right and left buttons to scroll between previews, and some details on the application, including the review from the software center. Further two buttons; developer site and a download button should exist below the preview"
../testcases/image/1448_Unity Lenses,9,Ambiguous Test,verb + indefinite determiner,verification,showing a,"A lens preview should appear showing a preview of the application (potentially a screenshot), with right and left buttons to scroll between previews, and some details on the application, including the review from the software center. Further two buttons; uninstall and launch should exist below the preview"
../testcases/image/1448_Unity Lenses,9,Ambiguous Test,verb + indefinite determiner,verification,showing a,"A lens preview should appear showing a preview of the application (potentially a screenshot), with right and left buttons to scroll between previews, and some details on the application, including the review from the software center. Further two buttons; developer site and a download button should exist below the preview"
../testcases/image/1448_Unity Lenses,9,Ambiguous Test,verb + indefinite determiner,verification,add a,The application should install and add a new launcher icon to the launcher
../testcases/image/1448_Unity Lenses,10,Ambiguous Test,adverb of manner,verification,potentially,"A lens preview should appear showing a preview of the item (potentially a picture), with right and left buttons to scroll between previews, and some details on the item. Further one buy button should exist below the preview"
../testcases/image/1448_Unity Lenses,10,Ambiguous Test,adjective,action,more,Right click on one of the listings in the more-suggestions category
../testcases/image/1448_Unity Lenses,10,Ambiguous Test,adjective,verification,more,A more-suggestions category should appear
../testcases/image/1448_Unity Lenses,10,Ambiguous Test,verb + indefinite determiner,verification,showing a,"A lens preview should appear showing a preview of the item (potentially a picture), with right and left buttons to scroll between previews, and some details on the item. Further one buy button should exist below the preview"
../testcases/image/1451_Install (entire disk with lvm and encryption),0,Ambiguous Test,adverb of manner,action,only,"If there is only one hard disk, skip to step 14 (On the 'Where are you?' screen...). Otherwise, on the 'Installation type' screen verify that the drive selected on the Select drive list corresponds to the drive on the chart (e.g /dev/sda)"
../testcases/image/1451_Install (entire disk with lvm and encryption),0,Ambiguous Test,adverb of manner,verification,properly,The system boots properly and loads the installer displaying Welcome dialog with language selection and 'Try FAMILY' and 'Install FAMILY' buttons
../testcases/image/1451_Install (entire disk with lvm and encryption),0,Ambiguous Test,adverb of manner,verification,accurately,Available options should represent the state of your system accurately
../testcases/image/1451_Install (entire disk with lvm and encryption),0,Ambiguous Test,adverb of manner,verification,Additionally,"Name, username and password are accepted. Additionally, the continue button is enabled"
../testcases/image/1451_Install (entire disk with lvm and encryption),0,Ambiguous Test,adverb of manner,verification,entirely,The slideshow is entirely in your language
../testcases/image/1451_Install (entire disk with lvm and encryption),0,Ambiguous Test,adverb of manner,verification,properly,The system boots properly
../testcases/image/1451_Install (entire disk with lvm and encryption),0,Ambiguous Test,verb + indefinite determiner,action,Enter a,Enter a security key and type a different key into the 'confirm the security key' input box
../testcases/image/1451_Install (entire disk with lvm and encryption),0,Ambiguous Test,verb + indefinite determiner,action,type a,Enter a security key and type a different key into the 'confirm the security key' input box
../testcases/image/1451_Install (entire disk with lvm and encryption),0,Ambiguous Test,verb + indefinite determiner,action,Enter a,Enter a security key and type the same key into the 'confirm the security key' input box
../testcases/image/1451_Install (entire disk with lvm and encryption),0,Ambiguous Test,verb + indefinite determiner,verification,Choose a,The 'Choose a security key' screen is displayed with the 'Install now' button greyed out
