Test file,Test index,Smell,Hint,Where,Term,Sentence
../testcases/packages/Xfce/1573_Xfce4 Dictionary,4,Ambiguous Test,verb + indefinite determiner,verification,returns that,"The Dictionary application opens and returns that word from whichever ""Search with:"" mode you had selected as the default (i.e., Dictionary Server, Web Server or Spell Checker)"
../testcases/packages/Xfce/1574_Xfce4 Settings Manager,1,Ambiguous Test,verb + indefinite determiner,action,Open a,"Open a terminal and type sudo apt-get install arandr press enter, supply password as required and enter"
../testcases/packages/Xfce/1574_Xfce4 Settings Manager,2,Ambiguous Test,verb + indefinite determiner,action,Click All,Click All Settings button
../testcases/packages/Xfce/1575_Xfce4 Appearance Settings,1,Ambiguous Test,verb + indefinite determiner,action,select another,"With the ""Appearance"" module open to the ""Style"" tab, select another style."
../testcases/packages/Xfce/1575_Xfce4 Appearance Settings,1,Ambiguous Test,verb + indefinite determiner,action,Open a,Open a terminal and install the clearlooks-phenix-theme package sudo apt-get install clearlooks-phenix-theme
../testcases/packages/Xfce/1575_Xfce4 Appearance Settings,1,Ambiguous Test,verb + indefinite determiner,action,Open a,Open a terminal and purge the clearlooks-phenix-theme package and gtks2-engines sudo apt-get purge clearlooks-phenix-theme gtk2-engines
../testcases/packages/Xfce/1575_Xfce4 Appearance Settings,2,Ambiguous Test,adverb of manner,verification,newly,The icons on the screen change to the newly-selected icon theme.
../testcases/packages/Xfce/1575_Xfce4 Appearance Settings,2,Ambiguous Test,adverb of manner,verification,newly,The icons on the screen change to the newly-selected icon theme.
../testcases/packages/Xfce/1575_Xfce4 Appearance Settings,2,Ambiguous Test,verb + indefinite determiner,action,select another,"With the ""Appearance"" module loaded and the ""Icons"" tab visible, select another icon theme."
../testcases/packages/Xfce/1575_Xfce4 Appearance Settings,2,Ambiguous Test,verb + indefinite determiner,action,Open a,Open a terminal and install the tango-icon-theme package sudo apt-get install tango-icon-theme
../testcases/packages/Xfce/1575_Xfce4 Appearance Settings,2,Ambiguous Test,verb + indefinite determiner,action,Open a,Open a terminal and remove the tango-icon-theme package sudo apt-get purge tango-icon-theme
../testcases/packages/Xfce/1575_Xfce4 Appearance Settings,3,Ambiguous Test,adverb of manner,verification,accordingly,The on-screen fonts change accordingly.
../testcases/packages/Xfce/1575_Xfce4 Appearance Settings,3,Ambiguous Test,adjective,verification,blockier,The on-screen fonts change (they appear blockier).
../testcases/packages/Xfce/1575_Xfce4 Appearance Settings,3,Ambiguous Test,adjective,verification,smoother,The fonts change again (appear smoother).
../testcases/packages/Xfce/1575_Xfce4 Appearance Settings,4,Ambiguous Test,verb + indefinite determiner,action,load a,"With the ""Appearance"" module loaded and the ""Settings"" tab visible, load a GTK-compliant application (e.g. Globaltime Preferences)."
../testcases/packages/Xfce/1575_Xfce4 Appearance Settings,4,Ambiguous Test,verb + indefinite determiner,action,maximize a,"Check the ""Enable event sounds"" checkbox and minimize/maximize a window."
../testcases/packages/Xfce/1576_Xfce4 Session and Startup Settings,0,Ambiguous Test,verb + indefinite determiner,action,Press All,Press All Settings
../testcases/packages/Xfce/1576_Xfce4 Session and Startup Settings,2,Ambiguous Test,adverb of manner,verification,momentarily,Session save dialogue momentarily appears and closes
../testcases/packages/Xfce/1576_Xfce4 Session and Startup Settings,4,Ambiguous Test,adjective,action,more,"Close Session and startup, logout and then login once more"
../testcases/packages/Xfce/1580_Xfdesktop Settings,1,Ambiguous Test,adverb of manner,action,currently,Under 'Background' click on a wallpaper other than the one currently selected
../testcases/packages/Xfce/1580_Xfdesktop Settings,1,Ambiguous Test,adverb of manner,verification,accordingly,Wallpaper changes accordingly
../testcases/packages/Xfce/1580_Xfdesktop Settings,1,Ambiguous Test,adverb of manner,verification,correctly,Added background is set correctly
../testcases/packages/Xfce/1580_Xfdesktop Settings,1,Ambiguous Test,verb + indefinite determiner,action,select a,"If other image folders are available, navigate in Folder dropdown and select a new wallpaper"
../testcases/packages/Xfce/1580_Xfdesktop Settings,1,Ambiguous Test,verb + indefinite determiner,action,Select a,Select a different wallpaper
../testcases/packages/Xfce/1580_Xfdesktop Settings,2,Ambiguous Test,adverb of manner,verification,correctly,Ensure that each are applied correctly.
../testcases/packages/Xfce/1580_Xfdesktop Settings,2,Ambiguous Test,adverb of manner,verification,correctly,They are set correctly
../testcases/packages/Xfce/1580_Xfdesktop Settings,3,Ambiguous Test,adverb of manner,verification,correctly,The 'Applications' menu loads up a list of applications correctly
../testcases/packages/Xfce/1580_Xfdesktop Settings,3,Ambiguous Test,adverb of manner,verification,correctly,Observe in turn that it shows and hides the applications menu correctly.
../testcases/packages/Xfce/1580_Xfdesktop Settings,4,Ambiguous Test,adverb of manner,verification,currently,Ensure the desktop icons now represent the currently running applications
../testcases/packages/Xfce/1580_Xfdesktop Settings,4,Ambiguous Test,adverb of manner,verification,correctly,Observe that the icons change size correctly. Check that manually entering a value also has the required effect.
../testcases/packages/Xfce/1580_Xfdesktop Settings,4,Ambiguous Test,adverb of manner,verification,manually,Observe that the icons change size correctly. Check that manually entering a value also has the required effect.
../testcases/packages/Xfce/1580_Xfdesktop Settings,4,Ambiguous Test,adverb of manner,verification,correctly,"Ensure that using the up or down arrows, or entering a value, changes the icon font size correctly. Unchecking the box should restore the font size to default"
../testcases/packages/Xfce/1580_Xfdesktop Settings,4,Ambiguous Test,adverb of manner,verification,correctly,Desktop thumbnails are shown and hidden correctly (may need some video or image files on the desktop to check this).
../testcases/packages/Xfce/1580_Xfdesktop Settings,4,Ambiguous Test,verb + indefinite determiner,verification,entering a,Observe that the icons change size correctly. Check that manually entering a value also has the required effect.
../testcases/packages/Xfce/1580_Xfdesktop Settings,4,Ambiguous Test,verb + indefinite determiner,verification,entering a,"Ensure that using the up or down arrows, or entering a value, changes the icon font size correctly. Unchecking the box should restore the font size to default"
../testcases/packages/Xfce/1580_Xfdesktop Settings,4,Ambiguous Test,verb + indefinite determiner,verification,need some,Desktop thumbnails are shown and hidden correctly (may need some video or image files on the desktop to check this).
../testcases/packages/Xfce/1581_Xfce4 MIME Settings,1,Ambiguous Test,adverb of manner,verification,incrementally,The MIME Type list is filtered incrementally with partial matches as you type more characters
../testcases/packages/Xfce/1581_Xfce4 MIME Settings,1,Ambiguous Test,adverb of manner,verification,alphabetically,The list is sorted alphabetically by application name
../testcases/packages/Xfce/1581_Xfce4 MIME Settings,1,Ambiguous Test,adverb of manner,verification,alphabetically,The list is sorted alphabetically by MIME Type
../testcases/packages/Xfce/1581_Xfce4 MIME Settings,1,Ambiguous Test,adjective,verification,more,The MIME Type list is filtered incrementally with partial matches as you type more characters
../testcases/packages/Xfce/1581_Xfce4 MIME Settings,1,Ambiguous Test,verb + indefinite determiner,action,Enter some,"Enter some text in the ""Filter:"" field (e.g., ""image"")"
../testcases/packages/Xfce/1581_Xfce4 MIME Settings,1,Ambiguous Test,verb + indefinite determiner,verification,displays all,The filter criterion is cleared and the application again displays all available MIME types
../testcases/packages/Xfce/1582_Xfce4 Power Manager Settings,1,Ambiguous Test,verb + indefinite determiner,verification,does a,The laptop does a normal shutdown
../testcases/packages/Xfce/1582_Xfce4 Power Manager Settings,2,Ambiguous Test,adverb of manner,verification,Newly,Newly selected options are set
../testcases/packages/Xfce/1582_Xfce4 Power Manager Settings,2,Ambiguous Test,adjective,verification,shortest,Note: 15 minutes is the shortest duration you can set with the sliders
../testcases/packages/Xfce/1582_Xfce4 Power Manager Settings,2,Ambiguous Test,verb + indefinite determiner,action,Move both,"Move both ""Put system to sleep when inactive for"" sliders to the right to set them for 15 Minutes"
../testcases/packages/Xfce/1582_Xfce4 Power Manager Settings,3,Ambiguous Test,adverb of manner,action,approximately,"Move the ""Blank after"" slider under ""On battery"" to approximately 5 minutes"
../testcases/packages/Xfce/1582_Xfce4 Power Manager Settings,3,Ambiguous Test,adverb of manner,action,approximately,"Move the ""Put to sleep after"" and ""Switch off after"" sliders under ""On battery"" to approximately 10 minutes and 15 minutes respectively"
../testcases/packages/Xfce/1582_Xfce4 Power Manager Settings,3,Ambiguous Test,adverb of manner,action,respectively,"Move the ""Put to sleep after"" and ""Switch off after"" sliders under ""On battery"" to approximately 10 minutes and 15 minutes respectively"
../testcases/packages/Xfce/1582_Xfce4 Power Manager Settings,3,Ambiguous Test,adverb of manner,verification,respectively,"The ""Put to sleep after"" and ""Switch off after"" sliders also move to +1 minute and +2 minutes respectively compared to the ""Blank after"" slider"
../testcases/packages/Xfce/1582_Xfce4 Power Manager Settings,3,Ambiguous Test,adverb of manner,verification,respectively,"The ""Put to sleep after"" and Blank after"" sliders move to -1 minute and -2 minutes respectively compared to the ""Switch off after"" slider"
../testcases/packages/Xfce/1582_Xfce4 Power Manager Settings,4,Ambiguous Test,adverb of manner,action,Automatically,"Change ""Automatically lock the session"" to ""When the screensaver is activated"""
../testcases/packages/Xfce/1582_Xfce4 Power Manager Settings,4,Ambiguous Test,adverb of manner,verification,immediately,The screen is restored immediately
../testcases/packages/Xfce/1582_Xfce4 Power Manager Settings,4,Ambiguous Test,adjective,action,more,Wait 10 more seconds and then move your mouse
../testcases/packages/Xfce/1582_Xfce4 Power Manager Settings,4,Ambiguous Test,verb + indefinite determiner,action,Wait another,Wait another minute
../testcases/packages/Xfce/1583_Xfce4 Task Manager,0,Ambiguous Test,adverb of manner,verification,currently,The Task Manager application opens and displays a list of all tasks that are currently running
../testcases/packages/Xfce/1583_Xfce4 Task Manager,0,Ambiguous Test,verb + indefinite determiner,verification,displays a,The Task Manager application opens and displays a list of all tasks that are currently running
../testcases/packages/Xfce/1583_Xfce4 Task Manager,1,Ambiguous Test,adjective,verification,more,One or more tasks show a fluctuating utilization percentage
../testcases/packages/Xfce/1583_Xfce4 Task Manager,1,Ambiguous Test,verb + indefinite determiner,verification,show a,One or more tasks show a fluctuating utilization percentage
../testcases/packages/Xfce/1583_Xfce4 Task Manager,2,Ambiguous Test,verb + indefinite determiner,action,Type an,"Type an ""m"" at the end of the search term making it ""term"""
../testcases/packages/Xfce/1583_Xfce4 Task Manager,2,Ambiguous Test,verb + indefinite determiner,verification,indicating no,A red icon appears next to the search term indicating no matching application could be found
../testcases/packages/Xfce/1583_Xfce4 Task Manager,2,Ambiguous Test,verb + indefinite determiner,verification,show a,"The Application Finder dialog expands to show a list of applications containing the string ""ter"""
../testcases/packages/Xfce/1583_Xfce4 Task Manager,3,Ambiguous Test,adjective,action,more,"Back in Task Manager, right-click on the task once more"
../testcases/packages/Xfce/1583_Xfce4 Task Manager,3,Ambiguous Test,indefinite pronoun,action,something,Switch to the Terminal window and type something
../testcases/packages/Xfce/1583_Xfce4 Task Manager,3,Ambiguous Test,indefinite pronoun,action,something,Switch to the Terminal window and type something again
../testcases/packages/Xfce/1583_Xfce4 Task Manager,3,Ambiguous Test,indefinite pronoun,verification,Nothing,Nothing happens because the session is stopped
../testcases/packages/Xfce/1583_Xfce4 Task Manager,4,Ambiguous Test,comparative adverb,verification,more,"""Show all processes"" shows even more running processes but may not increment the number of processes displayed on the status bar"
../testcases/packages/Xfce/1583_Xfce4 Task Manager,4,Ambiguous Test,adjective,verification,More,"""More precision"" - CPU, Memory and Swap utilization percentages are displayed to two decimal places (although not when hovering over the panel icon)"
../testcases/packages/Xfce/1583_Xfce4 Task Manager,4,Ambiguous Test,verb + indefinite determiner,verification,Show all,"""Show all processes"" shows even more running processes but may not increment the number of processes displayed on the status bar"
../testcases/packages/Xfce/1584_Xfwm4 Settings,2,Ambiguous Test,verb + indefinite determiner,action,Move an,Move an Active button to the Hidden area
../testcases/packages/Xfce/1584_Xfwm4 Settings,3,Ambiguous Test,verb + indefinite determiner,action,Open any,Open any other application
../testcases/packages/Xfce/1584_Xfwm4 Settings,3,Ambiguous Test,verb + indefinite determiner,action,Deselect all,"Deselect all focus options, leaving focus model at Click to focus"
../testcases/packages/Xfce/1584_Xfwm4 Settings,4,Ambiguous Test,verb + indefinite determiner,action,Select both,Select both Box move and resize options
../testcases/packages/Xfce/1584_Xfwm4 Settings,4,Ambiguous Test,verb + indefinite determiner,action,Select both,Select both Box move and resize options
../testcases/packages/Xfce/1585_Xfce4 Application Finder,3,Ambiguous Test,verb + indefinite determiner,action,Select an,Select an application from All Applications and press Launch button
../testcases/packages/Xfce/1586_Xfce4 Display Settings,1,Ambiguous Test,adverb of manner,verification,correctly,Settings are applied correctly as appropriate
../testcases/packages/Xfce/1586_Xfce4 Display Settings,1,Ambiguous Test,verb + indefinite determiner,action,choose a,"From Resolution drop down, choose a different monitor resolution"
../testcases/packages/Xfce/1586_Xfce4 Display Settings,1,Ambiguous Test,verb + indefinite determiner,action,Keep this,Select Keep this resolution
../testcases/packages/Xfce/1586_Xfce4 Display Settings,1,Ambiguous Test,verb + indefinite determiner,action,Keep this,"Reset resolution to default as required, press Keep this configuration when prompted"
../testcases/packages/Xfce/1586_Xfce4 Display Settings,2,Ambiguous Test,verb + indefinite determiner,action,choose a,"From Resolution drop down, choose a different monitor resolution"
../testcases/packages/Xfce/1586_Xfce4 Display Settings,2,Ambiguous Test,verb + indefinite determiner,action,Keep this,Select Keep this resolution
../testcases/packages/Xfce/1589_Xfce4 Thunar Volman,1,Ambiguous Test,adverb of manner,verification,automatically,Both media appear in the side pane of File Manager and are automatically mounted but no contents are displayed in the File Manager window
../testcases/packages/Xfce/1589_Xfce4 Thunar Volman,1,Ambiguous Test,adverb of manner,verification,automatically,"Both media appear in the side pane, they are automatically mounted and their contents are displayed in the File Manager window"
../testcases/packages/Xfce/1589_Xfce4 Thunar Volman,1,Ambiguous Test,verb + indefinite determiner,action,Uncheck all,Uncheck all the options under 'Removable Storage'
../testcases/packages/Xfce/1589_Xfce4 Thunar Volman,1,Ambiguous Test,verb + indefinite determiner,action,check both,"In the Removable Drives and Media dialog, check both 'Mount removable drives when hot-plugged' and 'Mount removable media when inserted'"
../testcases/packages/Xfce/1589_Xfce4 Thunar Volman,1,Ambiguous Test,verb + indefinite determiner,action,Eject both,Eject both media again
../testcases/packages/Xfce/1589_Xfce4 Thunar Volman,1,Ambiguous Test,verb + indefinite determiner,action,Eject both,Eject both media
../testcases/packages/Xfce/1589_Xfce4 Thunar Volman,1,Ambiguous Test,verb + indefinite determiner,action,Burn a,Check the 'Burn a CD or DVD when a blank disc is inserted' option under 'Blank CDs and DVDs'
../testcases/packages/Xfce/1589_Xfce4 Thunar Volman,2,Ambiguous Test,adverb of manner,verification,greatly,Note: portable music player formats vary too greatly to allow a standardized test to be included here 
../testcases/packages/Xfce/1589_Xfce4 Thunar Volman,2,Ambiguous Test,adverb of manner,verification,automatically,The discs play automatically after they are inserted
../testcases/packages/Xfce/1589_Xfce4 Thunar Volman,2,Ambiguous Test,adverb of manner,verification,automatically,The discs will not play automatically but will behave according to the current settings under the Storage tab for removable media
../testcases/packages/Xfce/1589_Xfce4 Thunar Volman,2,Ambiguous Test,verb + indefinite determiner,action,is a,Ensure that both the Audio and Video options are checked and that there is a default command for Parole in the 'Command:' fields
../testcases/packages/Xfce/1589_Xfce4 Thunar Volman,2,Ambiguous Test,verb + indefinite determiner,verification,allow a,Note: portable music player formats vary too greatly to allow a standardized test to be included here 
../testcases/packages/Xfce/1590_Xfce4 Window Manager Tweaks,1,Ambiguous Test,adverb of manner,action,repeatedly,Press Alt+Tab repeatedly
../testcases/packages/Xfce/1590_Xfce4 Window Manager Tweaks,1,Ambiguous Test,adverb of manner,action,repeatedly,Press Alt+Tab repeatedly
../testcases/packages/Xfce/1590_Xfce4 Window Manager Tweaks,1,Ambiguous Test,adverb of manner,action,repeatedly,Press Alt+Tab repeatedly
../testcases/packages/Xfce/1590_Xfce4 Window Manager Tweaks,1,Ambiguous Test,adverb of manner,action,repeatedly,Press Alt+Tab repeatedly
../testcases/packages/Xfce/1590_Xfce4 Window Manager Tweaks,1,Ambiguous Test,verb + indefinite determiner,action,Open any,Open any application and minimise it
../testcases/packages/Xfce/1590_Xfce4 Window Manager Tweaks,1,Ambiguous Test,verb + indefinite determiner,action,open another,"Change to another workspace, open another application"
../testcases/packages/Xfce/1590_Xfce4 Window Manager Tweaks,2,Ambiguous Test,adverb of manner,action,approximately,Change value of opacity of windows during move to approximately 50%
../testcases/packages/Xfce/1590_Xfce4 Window Manager Tweaks,2,Ambiguous Test,adverb of manner,verification,slightly,While window moves - window is slightly transparent
../testcases/packages/Xfce/1590_Xfce4 Window Manager Tweaks,2,Ambiguous Test,adverb of manner,verification,completely,While window moves - window is completely opaque
../testcases/packages/Xfce/1628_Xubuntu Post-install,2,Ambiguous Test,verb + indefinite determiner,action,have a,"If you have a USB drive, plug it in"
../testcases/packages/1306_Kernel (smoke),0,Ambiguous Test,adverb of manner,action,properly,Does the system boot properly?
../testcases/packages/1306_Kernel (smoke),0,Ambiguous Test,adverb of manner,action,properly,Is your networking hardware properly recognized?
../testcases/packages/1308_software-properties (smoke),0,Ambiguous Test,adverb of manner,action,properly,Does the gui work properly and function well?
../testcases/packages/1414_Deja-Dup,0,Ambiguous Test,adverb of manner,action,correctly,Open Nautilus and check that test folder and files are created correctly
../testcases/packages/1414_Deja-Dup,0,Ambiguous Test,adverb of manner,verification,correctly,Was your test folder and the test file contained within it restored correctly to your home folder?
../testcases/packages/1414_Deja-Dup,0,Ambiguous Test,verb + indefinite determiner,action,Create a,Create a test folder in your home directory with one test text file.
../testcases/packages/1414_Deja-Dup,0,Ambiguous Test,verb + indefinite determiner,action,Remove all,"Click 'Folders' tab. Remove all folders from 'Folders to backup' list, then add your test folder containing the test document file"
../testcases/packages/1414_Deja-Dup,0,Ambiguous Test,verb + indefinite determiner,action,select a,Click 'Storage' tab and select a valid backup location
../testcases/packages/1414_Deja-Dup,0,Ambiguous Test,verb + indefinite determiner,action,requests a,"If 'Back Up' window requests a password, select 'Allow restoring without a password' radio button and click 'Continue'"
../testcases/packages/1414_Deja-Dup,0,Ambiguous Test,verb + indefinite determiner,action,check that,Open Nautilus and check that test folder and files are created correctly
../testcases/packages/1415_Empathy,1,Ambiguous Test,adverb of manner,verification,correctly,Are messages being delivered and displayed correctly?
../testcases/packages/1416_Eye of Gnome,0,Ambiguous Test,adverb of manner,verification,correctly,Is the image being displayed correctly?
../testcases/packages/1416_Eye of Gnome,0,Ambiguous Test,verb + indefinite determiner,action,Open an,"Open an image file by selecting file, open and then choosing an image file"
../testcases/packages/1416_Eye of Gnome,0,Ambiguous Test,verb + indefinite determiner,action,choosing an,"Open an image file by selecting file, open and then choosing an image file"
../testcases/packages/1416_Eye of Gnome,1,Ambiguous Test,verb + indefinite determiner,action,Open an,"Open an image file by selecting file, open and then choosing an image file"
../testcases/packages/1416_Eye of Gnome,1,Ambiguous Test,verb + indefinite determiner,action,choosing an,"Open an image file by selecting file, open and then choosing an image file"
../testcases/packages/1416_Eye of Gnome,2,Ambiguous Test,adverb of manner,verification,correctly,Is the image viewer displaying the previous and next images correctly?
../testcases/packages/1416_Eye of Gnome,2,Ambiguous Test,verb + indefinite determiner,action,Open an,"Open an image file by selecting file, open and then choosing an image file"
../testcases/packages/1416_Eye of Gnome,2,Ambiguous Test,verb + indefinite determiner,action,choosing an,"Open an image file by selecting file, open and then choosing an image file"
../testcases/packages/1416_Eye of Gnome,3,Ambiguous Test,comparative adverb,action,earlier,Highlight the deleted image file from earlier and select restore. Resume focus on the image viewer application and click the previous button
../testcases/packages/1416_Eye of Gnome,3,Ambiguous Test,verb + indefinite determiner,action,Open an,"Open an image file by selecting file, open and then choosing an image file"
../testcases/packages/1416_Eye of Gnome,3,Ambiguous Test,verb + indefinite determiner,action,choosing an,"Open an image file by selecting file, open and then choosing an image file"
../testcases/packages/1416_Eye of Gnome,4,Ambiguous Test,adverb of manner,action,vertically,"Select edit, flip vertically"
../testcases/packages/1416_Eye of Gnome,4,Ambiguous Test,adverb of manner,action,vertically,"Select edit, flip vertically"
../testcases/packages/1416_Eye of Gnome,4,Ambiguous Test,adverb of manner,verification,horizontally,The image is flipped horizontally
../testcases/packages/1416_Eye of Gnome,4,Ambiguous Test,adverb of manner,verification,vertically,The image is flipped vertically
../testcases/packages/1416_Eye of Gnome,4,Ambiguous Test,adverb of manner,verification,vertically,The image is flipped vertically
../testcases/packages/1416_Eye of Gnome,4,Ambiguous Test,adverb of manner,verification,horizontally,The image is flipped horizontally
../testcases/packages/1416_Eye of Gnome,4,Ambiguous Test,adverb of manner,verification,correctly,Is the image that was being flipped correctly and now restored to its original state?
../testcases/packages/1416_Eye of Gnome,4,Ambiguous Test,verb + indefinite determiner,action,Open an,"Open an image file by selecting file, open and then choosing an image file"
../testcases/packages/1416_Eye of Gnome,4,Ambiguous Test,verb + indefinite determiner,action,choosing an,"Open an image file by selecting file, open and then choosing an image file"
../testcases/packages/1416_Eye of Gnome,5,Ambiguous Test,verb + indefinite determiner,action,Open an,"Open an image file by selecting file, open and then choosing an image file"
../testcases/packages/1416_Eye of Gnome,5,Ambiguous Test,verb + indefinite determiner,action,choosing an,"Open an image file by selecting file, open and then choosing an image file"
../testcases/packages/1417_Evince,0,Ambiguous Test,adverb of manner,verification,correctly,The selected PDF is displayed correctly
../testcases/packages/1417_Evince,0,Ambiguous Test,verb + indefinite determiner,action,Open a,"Open a pdf by selecting file, open and choosing a pdf file"
../testcases/packages/1417_Evince,0,Ambiguous Test,verb + indefinite determiner,action,choosing a,"Open a pdf by selecting file, open and choosing a pdf file"
../testcases/packages/1417_Evince,1,Ambiguous Test,adverb of manner,verification,correctly,Evince exits fullscreen mode and restores the window size and position correctly
